<?xml version="1.0" encoding="UTF-8"?>


<fo
	xmlns:xsi="http://www.w3.org/2001/XMLSChema-instance"
		xsi:noNamespaceSchemaLocation="ERtoXSD.xsd">
	<A a1="001" K1="002">
		<b>
			<x></x>
			<y></y>
		</b>
		<c></c>
	</A>
	
	<B b1="002">
		<B>
			<x></x>
			<y></y>
		</B>
	</B>
	
	<C c1="003" K2="002">
		<b></b>
	</C>
		
</fo>
